{
  "header_line": 1,
  "separator": ",",
  "decimal_comma": false,
  "clock": 0,
  "columns": [
    {
      "name": "ts",
      "quantity": null,
      "unit": "s"
    },
    {
      "name": "latitude",
      "quantity": "latitude",
      "unit": "deg"
    },
    {
      "name": "longitude",
      "quantity": "longitude",
      "unit": "deg"
    },
    {
      "name": "satellites",
      "quantity": null,
      "unit": null,
      "skip": true
    }
  ]
}
